{
  "$schema": "https://json-schema.org/draft/2020-12/schema",
  "$id": "https://gurubodh.local/schemas/prep_subject_job.schema.json",
  "title": "Gurubodh Prep Subject Job",
  "type": "object",
  "required": ["schema_version", "pipeline", "source", "destination", "naming", "chapter_split", "metadata_defaults", "proofreading"],
  "properties": {
    "schema_version": {
      "type": "string",
      "const": "1.5.0"
    },
    "pipeline": {
      "type": "string",
      "enum": ["legacy-docx-to-unicode", "unicode-docx-ingest"]
    },
    "source": {
      "type": "object",
      "properties": {
        "backend": {
          "type": "string",
          "enum": ["local", "r2"]
        },
        "root_dir": {
          "type": "string",
          "minLength": 1
        },
        "relative_path": {
          "type": "string",
          "minLength": 1
        },
        "bucket": {
          "type": "string",
          "minLength": 1
        },
        "key": {
          "type": "string",
          "minLength": 1
        },
        "url_base": {
          "type": ["string", "null"]
        },
        "font_encoding": {
          "type": "string",
          "enum": ["aps", "unicode"]
        },
        "file_format": {
          "type": "string",
          "const": "docx"
        }
      },
      "required": ["backend", "font_encoding", "file_format"],
      "allOf": [
        {
          "if": {
            "properties": {
              "backend": {
                "const": "r2"
              }
            },
            "required": ["backend"]
          },
          "then": {
            "required": ["bucket", "key", "url_base"]
          },
          "else": {
            "required": ["root_dir", "relative_path"]
          }
        }
      ],
      "additionalProperties": false
    },
    "destination": {
      "type": "object",
      "required": ["backend", "subject_dir"],
      "properties": {
        "backend": {
          "type": "string",
          "enum": ["local", "r2"]
        },
        "root_dir": {
          "type": "string",
          "minLength": 1
        },
        "bucket": {
          "type": "string",
          "minLength": 1
        },
        "prefix": {
          "type": "string",
          "minLength": 1
        },
        "subject_dir": {
          "type": "string",
          "minLength": 1
        },
        "url_base": {
          "type": ["string", "null"]
        }
      },
      "allOf": [
        {
          "if": {
            "properties": {
              "backend": {
                "const": "r2"
              }
            },
            "required": ["backend"]
          },
          "then": {
            "required": ["bucket", "prefix", "url_base"]
          },
          "else": {
            "required": ["root_dir"]
          }
        }
      ],
      "additionalProperties": false
    },
    "naming": {
      "type": "object",
      "required": [
        "category_code",
        "subject_code",
        "title_slug",
        "version",
        "subversion"
      ],
      "properties": {
        "category_code": {
          "type": "string",
          "pattern": "^CAT[0-9]{3}$"
        },
        "subject_code": {
          "type": "string",
          "pattern": "^SUB[0-9]{3}$"
        },
        "title_slug": {
          "type": "string",
          "pattern": "^[A-Za-z0-9][A-Za-z0-9-]*$"
        },
        "version": {
          "type": "string",
          "pattern": "^[0-9]{2}$"
        },
        "subversion": {
          "type": "string",
          "pattern": "^[0-9]{2}$"
        }
      },
      "additionalProperties": false
    },
    "chapter_split": {
      "type": "object",
      "required": ["enabled"],
      "properties": {
        "enabled": {
          "type": "boolean"
        },
        "pattern_type": {
          "type": "string",
          "enum": ["literal", "regex"]
        },
        "pattern": {
          "type": "string",
          "minLength": 1
        },
        "flags": {
          "type": "array",
          "items": {
            "type": "string",
            "enum": ["IGNORECASE", "MULTILINE", "DOTALL", "VERBOSE"]
          },
          "uniqueItems": true
        }
      },
      "allOf": [
        {
          "if": {"properties": {"pattern_type": {"const": "regex"}}, "required": ["pattern_type"]},
          "then": {"required": ["flags"]}
        },
        {
          "if": {
            "properties": {
              "enabled": {
                "const": true
              }
            },
            "required": ["enabled"]
          },
          "then": {
            "required": ["pattern_type", "pattern"]
          }
        },
        {
          "if": {
            "properties": {
              "pattern_type": {
                "const": "literal"
              }
            },
            "required": ["pattern_type"]
          },
          "then": {
            "not": {
              "required": ["flags"]
            }
          }
        }
      ],
      "additionalProperties": false
    },
    "metadata_defaults": {
      "type": "object",
      "required": ["language", "source_script", "output_text_encoding", "summary_chapter_markers"],
      "properties": {
        "language": {
          "type": "string",
          "enum": ["hi-IN", "mr-IN"]
        },
        "source_script": {
          "type": "string",
          "const": "Devanagari"
        },
        "output_text_encoding": {
          "type": "string",
          "const": "UTF-8"
        },
        "summary_chapter_markers": {
          "type": "array",
          "items": {
            "type": "string",
            "minLength": 1
          }
        }
      },
      "additionalProperties": true
    },
    "proofreading": {
      "type": "object",
      "additionalProperties": false,
      "required": [
        "enabled",
        "provider",
        "model",
        "max_output_tokens",
        "max_input_characters",
        "max_retries",
        "initial_retry_delay_seconds",
        "max_retry_delay_seconds",
        "min_request_interval_seconds",
        "max_requests_per_minute",
        "max_estimated_input_tokens_per_minute",
        "request_timeout_seconds",
        "request_progress_interval_seconds",
        "unavailable_max_retries",
        "unavailable_first_retry_delay_seconds",
        "unavailable_second_retry_delay_seconds",
        "unavailable_cooldown_seconds",
        "continue_on_error"
      ],
      "properties": {
        "enabled": { "const": true },
        "provider": { "type": "string", "const": "google-ai-studio" },
        "model": { "type": "string", "minLength": 1 },
        "max_output_tokens": { "type": "integer", "minimum": 1 },
        "max_input_characters": { "type": "integer", "minimum": 1 },
        "max_retries": { "type": "integer", "minimum": 1 },
        "initial_retry_delay_seconds": { "type": "number", "minimum": 0 },
        "max_retry_delay_seconds": { "type": "number", "minimum": 0 },
        "min_request_interval_seconds": { "type": "number", "minimum": 0 },
        "max_requests_per_minute": { "type": "integer", "minimum": 1 },
        "max_estimated_input_tokens_per_minute": { "type": "integer", "minimum": 1 },
        "request_timeout_seconds": { "type": "number", "exclusiveMinimum": 0 },
        "request_progress_interval_seconds": { "type": "number", "exclusiveMinimum": 0 },
        "unavailable_max_retries": { "type": "integer", "minimum": 1, "maximum": 2 },
        "unavailable_first_retry_delay_seconds": { "type": "number", "exclusiveMinimum": 0 },
        "unavailable_second_retry_delay_seconds": { "type": "number", "exclusiveMinimum": 0 },
        "unavailable_cooldown_seconds": { "type": "number", "exclusiveMinimum": 0 },
        "continue_on_error": { "const": false }
      }
    }
  },
  "allOf": [
    {
      "if": {
        "properties": {
          "pipeline": {
            "const": "unicode-docx-ingest"
          }
        },
        "required": ["pipeline"]
      },
      "then": {
        "properties": {
          "source": {
            "properties": {
              "font_encoding": {
                "const": "unicode"
              }
            }
          }
        }
      }
    },
    {
      "if": {
        "properties": {
          "pipeline": {
            "const": "legacy-docx-to-unicode"
          }
        },
        "required": ["pipeline"]
      },
      "then": {
        "properties": {
          "source": {
            "properties": {
              "font_encoding": {
                "const": "aps"
              }
            }
          }
        }
      }
    }
  ],
  "additionalProperties": false
}
