{
  "schema_version": "1.5.0",
  "pipeline": "legacy-docx-to-unicode",
  "source": {
    "backend": "r2",
    "bucket": "gurubodh-library-dev",
    "key": "source_library/39_aacharan_shastra/aps_fonts/ms_word/sub039_aacharan_shastra.docx",
    "font_encoding": "aps",
    "file_format": "docx"
  },
  "destination": {
    "backend": "r2",
    "bucket": "gurubodh-library-dev",
    "prefix": "cms_library",
    "subject_dir": "39_aacharan_shastra/hi-IN",
    "url_base": null
  },
  "naming": {
    "category_code": "CAT004",
    "subject_code": "SUB039",
    "title_slug": "aacharan-shastra",
    "version": "01",
    "subversion": "01"
  },
  "chapter_split": {
    "enabled": true,
    "pattern_type": "literal",
    "pattern": "प्रबोधन क्र"
  },
  "metadata_defaults": {
    "language": "hi-IN",
    "source_script": "Devanagari",
    "output_text_encoding": "UTF-8",
    "summary_chapter_markers": [
      "उपसंहार",
      "उपसंहारात्मक",
      "उपसंभारात्मक",
      "उपसंभारात्त्मक",
      "उपसंभार"
    ]
  },
  "proofreading": {
    "provider": "google-ai-studio",
    "model": "gemini-3.6-flash",
    "max_output_tokens": 16384,
    "max_input_characters": 30000,
    "max_retries": 3,
    "initial_retry_delay_seconds": 2,
    "max_retry_delay_seconds": 30,
    "min_request_interval_seconds": 6,
    "max_requests_per_minute": 8,
    "max_estimated_input_tokens_per_minute": 20000,
    "enabled": true,
    "request_timeout_seconds": 120,
    "request_progress_interval_seconds": 15,
    "unavailable_max_retries": 2,
    "unavailable_first_retry_delay_seconds": 30,
    "unavailable_second_retry_delay_seconds": 90,
    "unavailable_cooldown_seconds": 120,
    "continue_on_error": false
  }
}
